tweet_id,user_username,text,author_id,conversation_id,in_reply_to_user_id,lang,created_at,possibly_sensitive,source,user_name,user_protected,user_url,user_description,user_profile_image_url,user_created_at,user_verified,user_pinned_tweet_id,user_location,retweet_count,like_count,quote_count,user_tweet_count,user_list_count,user_followers_count,user_following_count,sourcetweet_type,sourcetweet_id,sourcetweet_text,sourcetweet_lang,sourcetweet_author_id
1423037693018116105,tomio_cz,@BertiWolf @YouTube Dekuju,1710527172,1422843298084007940,858674464212611073,und,2021-08-04T21:46:39.000Z,FALSE,Twitter for iPhone,Tomio Okamura,FALSE,https://t.co/Ulv7TykfZL,"Ofici치ln칤 twitter p콏edsedy hnut칤 Svoboda a p콏칤m치 demokracie (SPD) Tomia Okamury. V칤ce na https://t.co/4VbQWYGZMJ, https://t.co/Ulv7TykfZL",https://pbs.twimg.com/profile_images/808994525385519104/2MBupdXy_normal.jpg,2013-08-29T17:24:17.000Z,FALSE,,,0,0,0,6145,167,29640,174,,,,,
1423020166242344962,tomio_cz,"Dnes ve캜er jsem si v r치mci boxersk칠ho tr칠ninku zatr칠noval p콏칤mo s mistrem sv캩ta Hakimem Majerem. A zavzpom칤nal jsem na dobu, kdy jsem p콏ed v칤ce ne t콏iceti lety boxoval juniorskou ligu za Uheln칠 sklady Praha游녨游낕 Hakime d캩kuju, 쬰 jsi si na m캩 ud캩lal 캜as, a p콏eji, a콘 se ti da콏칤游녨游낕 https://t.co/WkxsC3wjte",1710527172,1423020166242344962,,cs,2021-08-04T20:37:00.000Z,FALSE,Twitter for iPhone,Tomio Okamura,FALSE,https://t.co/Ulv7TykfZL,"Ofici치ln칤 twitter p콏edsedy hnut칤 Svoboda a p콏칤m치 demokracie (SPD) Tomia Okamury. V칤ce na https://t.co/4VbQWYGZMJ, https://t.co/Ulv7TykfZL",https://pbs.twimg.com/profile_images/808994525385519104/2MBupdXy_normal.jpg,2013-08-29T17:24:17.000Z,FALSE,,,5,66,0,6145,167,29640,174,,,,,
1423011596796928007,tomio_cz,@michal_illes To fakt ne. To Barto코 游땍,1710527172,1423005869961273344,1189381709667749888,cs,2021-08-04T20:02:57.000Z,FALSE,Twitter for iPhone,Tomio Okamura,FALSE,https://t.co/Ulv7TykfZL,"Ofici치ln칤 twitter p콏edsedy hnut칤 Svoboda a p콏칤m치 demokracie (SPD) Tomia Okamury. V칤ce na https://t.co/4VbQWYGZMJ, https://t.co/Ulv7TykfZL",https://pbs.twimg.com/profile_images/808994525385519104/2MBupdXy_normal.jpg,2013-08-29T17:24:17.000Z,FALSE,,,0,17,0,6145,167,29640,174,,,,,
1423005869961273344,tomio_cz,"Pr치v캩 jsem skon캜il boxersk칳 tr칠nink v Kladn캩 u mistra sv캩ta Hakima Majera a zavzpom칤nal jsem na dobu, kdy jsem boxoval juniorskou ligu za Uheln칠 sklady Praha游녨游낕 https://t.co/LbYTXSxdda",1710527172,1423005869961273344,,cs,2021-08-04T19:40:12.000Z,FALSE,Twitter for iPhone,Tomio Okamura,FALSE,https://t.co/Ulv7TykfZL,"Ofici치ln칤 twitter p콏edsedy hnut칤 Svoboda a p콏칤m치 demokracie (SPD) Tomia Okamury. V칤ce na https://t.co/4VbQWYGZMJ, https://t.co/Ulv7TykfZL",https://pbs.twimg.com/profile_images/808994525385519104/2MBupdXy_normal.jpg,2013-08-29T17:24:17.000Z,FALSE,,,9,106,6,6145,167,29640,174,,,,,
1422941886461923331,alenaschillerov,"Z dob, kdy byl je코t캩 ministrem financ칤 @AndrejBabis 游녨 https://t.co/4vmujhhPyP",1408164626,1422941886461923331,,cs,2021-08-04T15:25:57.000Z,FALSE,Twitter Web App,Alena Schillerov치,FALSE,"","Nesouhlas칤m s t칤m, co 콏칤k치te, ale a do smrti budu h치jit Va코e pr치vo to 콏칤kat.",https://pbs.twimg.com/profile_images/1421150921975795712/yu1uaRfs_normal.jpg,2013-05-06T16:32:47.000Z,FALSE,,"Brno, 캛esk치 republika",0,22,1,3732,176,40178,220,quoted,1422939947779166208,Dnes p콏ed 7 lety byla podeps치na Dohoda FATCA mezi 캛eskou republikou a Spojen칳mi st치ty americk칳mi 游뻟릖 游쥟릖 Jej칤m c칤lem je zabra켿ovat da켿ov칳m 칰nik콢m a zlep코ovat v칳m캩nu informac칤 mezi ob캩ma zem캩mi.,cs,724925828392427521
1422922769520529413,tomio_cz,Tomio Okamura: Sou캜asn치 koronavirov치 opat콏en칤 v 캛R https://t.co/hzutWacutb prost콏ednictv칤m @YouTube,1710527172,1422922769520529413,,cs,2021-08-04T14:09:59.000Z,FALSE,Twitter Web App,Tomio Okamura,FALSE,https://t.co/Ulv7TykfZL,"Ofici치ln칤 twitter p콏edsedy hnut칤 Svoboda a p콏칤m치 demokracie (SPD) Tomia Okamury. V칤ce na https://t.co/4VbQWYGZMJ, https://t.co/Ulv7TykfZL",https://pbs.twimg.com/profile_images/808994525385519104/2MBupdXy_normal.jpg,2013-08-29T17:24:17.000Z,FALSE,,,0,7,0,6145,167,29640,174,,,,,
1422919865535447040,tomio_cz,Tomio Okamura: Dne코n칤 aktuality 4.8.2021 https://t.co/zosHnvgA8q prost콏ednictv칤m @YouTube,1710527172,1422919865535447040,,cs,2021-08-04T13:58:27.000Z,FALSE,Twitter Web App,Tomio Okamura,FALSE,https://t.co/Ulv7TykfZL,"Ofici치ln칤 twitter p콏edsedy hnut칤 Svoboda a p콏칤m치 demokracie (SPD) Tomia Okamury. V칤ce na https://t.co/4VbQWYGZMJ, https://t.co/Ulv7TykfZL",https://pbs.twimg.com/profile_images/808994525385519104/2MBupdXy_normal.jpg,2013-08-29T17:24:17.000Z,FALSE,,,0,11,0,6145,167,29640,174,,,,,
1422901447734276102,alenaschillerov,"Novela z치kona o ozdravn칳ch postupech zv칳코칤 stabilitu finan캜n칤ho sektoru. N치vrh @MinFinCZ upravuje pravidla pro 콏e코en칤 p콏칤padn칳ch pot칤쮂 finan캜n칤ch instituc칤 tak, aby n치klady na 콏e코en칤 jejich probl칠m콢 nesli spole캜n칤ci a v캩콏itel칠. A ne da켿ov칤 poplatn칤ci. 
https://t.co/McMDT4Ooks",1408164626,1422901447734276102,,cs,2021-08-04T12:45:16.000Z,FALSE,Twitter Web App,Alena Schillerov치,FALSE,"","Nesouhlas칤m s t칤m, co 콏칤k치te, ale a do smrti budu h치jit Va코e pr치vo to 콏칤kat.",https://pbs.twimg.com/profile_images/1421150921975795712/yu1uaRfs_normal.jpg,2013-05-06T16:32:47.000Z,FALSE,,"Brno, 캛esk치 republika",0,16,0,3732,176,40178,220,,,,,
1422895730268819463,alenaschillerov,"Kompenza캜n칤 bonus @MinFinCZ pat콏il mezi nejrychlej코칤 a nejefektivn캩j코칤 vl치dn칤 pomoci. @financnisprava vyplatila 쬴vnostn칤k콢m, spole캜n칤k콢m mal칳ch s. r. o. a dohod치콏콢m t칠m캩콏 44 miliard korun 游녨 https://t.co/KliYxN3dvD",1408164626,1422895730268819463,,cs,2021-08-04T12:22:32.000Z,FALSE,Twitter Web App,Alena Schillerov치,FALSE,"","Nesouhlas칤m s t칤m, co 콏칤k치te, ale a do smrti budu h치jit Va코e pr치vo to 콏칤kat.",https://pbs.twimg.com/profile_images/1421150921975795712/yu1uaRfs_normal.jpg,2013-05-06T16:32:47.000Z,FALSE,,"Brno, 캛esk치 republika",3,16,1,3732,176,40178,220,quoted,1422542071336820737,Kompenza캜n칤 bonus kon캜칤. Pat콏il k맕e쮂멳an캩j코칤 a nejefektivn캩j코칤 podpo콏e https://t.co/05q2gTmAfP,cs,18484584
1422883920404746242,KarelHavlicek_,"Pr치v캩 se vrac칤m z m칤sta vlakov칠ho ne코t캩st칤 na Doma쬷icku. Velk칠 pod캩kov치n칤 zdravotn칤k콢m, hasi캜콢m, policii, kraji i obci, odv치d캩j칤 v칳bornou pr치ci. P콏칤캜iny nehody se vy코et콏uj칤, podle v코ech informac칤 do코lo k selh치n칤 lidsk칠ho faktoru u rychl칤ku, kter칳 nezastavil na n치v캩stidle St콢j.",1105851826702897152,1422883920404746242,,cs,2021-08-04T11:35:37.000Z,FALSE,Twitter for Android,Karel Havl칤캜ek,FALSE,"","M칤stop콏edseda Vl치dy 캛R @strakovka, ministr @mpo_tweetuje, ministr @min_dopravy a m칤stop콏edseda @Vedavyzkum",https://pbs.twimg.com/profile_images/1267448425416667136/LJWj2A2r_normal.jpg,2019-03-13T15:23:16.000Z,FALSE,,,5,123,5,2929,129,25474,202,,,,,
1422883121213628422,vojtafilip,"Je코t캩 jedna pozn치mka k energetick칠 nez치vislosti Evropy, nastane nejpozd캩ji v roce 2025, a bude v pln칠m provozu t캩쬭a ropy v nalezi코ti ""V칳chodn칤"" jde o budovan칠 arktick칠 lo쬴sko. Mysl칤m, 쬰 t칤m skon캜칤 pokus o politick칠 vyd칤r치n칤 Evropy ze strany USA, abychom na nich byli z치visl칤.",839771819469078529,1422883121213628422,,cs,2021-08-04T11:32:26.000Z,FALSE,Twitter Web App,Vojt캩ch Filip,FALSE,"",ob캜an 캛R a te캞 m칤stop콏edseda PS P캛R,https://pbs.twimg.com/profile_images/847367555232579584/h8tOUrML_normal.jpg,2017-03-09T09:36:18.000Z,FALSE,,,0,20,0,455,79,5179,29,,,,,
1422879548505526272,jhamacek,"D캩kuji v코em z치chran치콏콢m,hasi캜콢m i policist콢m zasahuj칤c칤m p콏i dne코n칤m 쬰leznicnim ne코t캩st칤 na Doma쬷icku. IZS zafungoval perfektn캩! https://t.co/nGJ29QOxkk",20664874,1422879548505526272,,cs,2021-08-04T11:18:14.000Z,FALSE,Twitter for iPhone,Jan Ham치캜ek,FALSE,https://t.co/egejlTRQs6,"P콏edseda @CSSD, ministr vnitra 游뻟릖 | Czech Interior Minister | Leader of the Czech Social Democratic Party",https://pbs.twimg.com/profile_images/1272874484576464897/M1nOy19-_normal.jpg,2009-02-12T09:44:43.000Z,FALSE,,캛esk치 republika,2,98,1,3918,353,90005,484,,,,,
1422868090346475520,alenaschillerov,"Hluboce lituji ji t콏칤 potvrzen칳ch ob캩t칤 sr치쬶y vlak콢 na Doma쬷icku. Up콏칤mnou soustrast poz콢stal칳m t칠to trag칠die. Kdo m콢쬰te, pros칤m, pomozte des칤tk치m zran캩n칳m a b캩쬾e darovat krev. Transf칰zn칤 odd캩len칤 plze켿sk칠 nemocnice popt치v치 v코echny krevn칤 skupiny. https://t.co/XsDo1ieiFc",1408164626,1422868090346475520,,cs,2021-08-04T10:32:43.000Z,FALSE,Twitter Web App,Alena Schillerov치,FALSE,"","Nesouhlas칤m s t칤m, co 콏칤k치te, ale a do smrti budu h치jit Va코e pr치vo to 콏칤kat.",https://pbs.twimg.com/profile_images/1421150921975795712/yu1uaRfs_normal.jpg,2013-05-06T16:32:47.000Z,FALSE,,"Brno, 캛esk치 republika",3,28,2,3732,176,40178,220,quoted,1422810318623870976,Na trati v obci Milav캜e na Doma쬷icku do코lo ke st콏etu dvou vlak콢. Podle p콏edb캩쬹칳ch informac칤 je na m칤st캩 28 zran캩n칳ch. Zasahuj칤 v코echny slo쬶y IZS. https://t.co/CjhB4ZxHSn,cs,116411298
1422853622895886336,AndrejBabis,"Zjistil jsem p콏칤mo od m칤stn칤ho starosty, jak oslovil sv칠 ob캜any. Je to pro m캩 d콢le쬴t칠. Moravskoslezsk칳 kraj je v o캜kov치ni v mnoha sm캩rech l칤dr, t콏eba v tom, jak o캜koval jako prvn칤 ve firm치ch. Z칤skal jsem tu dal코칤 cennou zku코enost, kterou m콢쬿 propagovat d치l.",713035525,1422853620953923587,713035525,cs,2021-08-04T09:35:13.000Z,FALSE,Twitter Web App,Andrej Babi코,FALSE,https://t.co/gBCJS8I2Z2,Ob캜an 캛R,https://pbs.twimg.com/profile_images/1415915729040314370/WHBP4JHt_normal.jpg,2012-07-23T20:12:03.000Z,TRUE,,,2,39,1,13996,778,453931,242,,,,,
1422853620953923587,AndrejBabis,"V칤tkov. Moravskoslezsk칳 kraj. Mobiln칤 o캜kovac칤 m칤sto bez registrace. R치no tu p콏ed kulturn칤m domem 캜ekalo asi 60 lid칤. Hejtman @ivondrak zorganizoval ve spolupr치ci s @FN_Ostrava v칳jezdy mobiln칤ch t칳mu p콏칤mo do obci. P콏ijel jsem se pod칤vat, jak to funguje. https://t.co/riE6v9YfqZ",713035525,1422853620953923587,,cs,2021-08-04T09:35:13.000Z,FALSE,Twitter Web App,Andrej Babi코,FALSE,https://t.co/gBCJS8I2Z2,Ob캜an 캛R,https://pbs.twimg.com/profile_images/1415915729040314370/WHBP4JHt_normal.jpg,2012-07-23T20:12:03.000Z,TRUE,,,6,62,2,13996,778,453931,242,,,,,
1422847958115098627,jhamacek,"Od r치na jsem v kontaktu s gener치ln칤m 콏editelem @hasici_cr Vl캜kem, kter칳 je na m칤st캩 tragick칠 nehody dvou vlak콢 na Doma쬷icku. V코echny slo쬶y IZS pracuj칤 s maxim치ln칤m nasazen칤m, moc jim d캩kuji. Cht캩l bych vyj치d콏it up콏칤mnou soustrast poz콢stal칳m a zran캩n칳m pop콏치t brzk칠 uzdraven칤.",20664874,1422847958115098627,,cs,2021-08-04T09:12:43.000Z,FALSE,Twitter for iPhone,Jan Ham치캜ek,FALSE,https://t.co/egejlTRQs6,"P콏edseda @CSSD, ministr vnitra 游뻟릖 | Czech Interior Minister | Leader of the Czech Social Democratic Party",https://pbs.twimg.com/profile_images/1272874484576464897/M1nOy19-_normal.jpg,2009-02-12T09:44:43.000Z,FALSE,,캛esk치 republika,3,94,0,3918,353,90005,484,,,,,
1422846529845481476,tomio_cz,"Chceme n치vrat k norm치lu. 游녨 Nechceme covid-diktaturu a omezov치n칤 ob캜ansk칳ch svobod. Nechceme diktaturu men코in a zvr치cenost칤. Nechceme dikt치t Bruselu, isl치m a masovou imigraci. Chceme st치t, kter칳 chr치n칤 rodinu. Chceme st치t, kter칳 chr치n칤 slu코n칠 lidi, a ne nep콏izp콢sobiv칠. https://t.co/FEHCxuYcLl",1710527172,1422846529845481476,,cs,2021-08-04T09:07:02.000Z,FALSE,Twitter for iPhone,Tomio Okamura,FALSE,https://t.co/Ulv7TykfZL,"Ofici치ln칤 twitter p콏edsedy hnut칤 Svoboda a p콏칤m치 demokracie (SPD) Tomia Okamury. V칤ce na https://t.co/4VbQWYGZMJ, https://t.co/Ulv7TykfZL",https://pbs.twimg.com/profile_images/808994525385519104/2MBupdXy_normal.jpg,2013-08-29T17:24:17.000Z,FALSE,,,11,101,2,6145,167,29640,174,,,,,
1422843298084007940,tomio_cz,Tomio Okamura o propagaci homosexualismu p콏ed mal칳mi d캩tmi ve 코kol치ch https://t.co/54OXzaM9yb prost콏ednictv칤m @YouTube,1710527172,1422843298084007940,,cs,2021-08-04T08:54:12.000Z,FALSE,Twitter Web App,Tomio Okamura,FALSE,https://t.co/Ulv7TykfZL,"Ofici치ln칤 twitter p콏edsedy hnut칤 Svoboda a p콏칤m치 demokracie (SPD) Tomia Okamury. V칤ce na https://t.co/4VbQWYGZMJ, https://t.co/Ulv7TykfZL",https://pbs.twimg.com/profile_images/808994525385519104/2MBupdXy_normal.jpg,2013-08-29T17:24:17.000Z,FALSE,,,1,31,0,6145,167,29640,174,,,,,
1422835700106399744,AndrejBabis,"Toto l칠to je bohu쬰l pln칠 trag칠di칤. Jsem v kontaktu s nov칳m 코칠fem hasi캜콢 Vladim칤rem Vl캜kem, s @jhamacek, i @KarelHavlicek_, kter칳 vyrazil na m칤sto. Up콏칤mnou soustrast rodin치m zem콏el칳ch. D콢le쬴t치 je z치chrana dal코칤ch 쬴vot콢. N치sledn캩 se v코e mus칤 vy코et콏it. https://t.co/Z9YPurGI10",713035525,1422835700106399744,,cs,2021-08-04T08:24:00.000Z,FALSE,Twitter Web App,Andrej Babi코,FALSE,https://t.co/gBCJS8I2Z2,Ob캜an 캛R,https://pbs.twimg.com/profile_images/1415915729040314370/WHBP4JHt_normal.jpg,2012-07-23T20:12:03.000Z,TRUE,,,4,115,7,13996,778,453931,242,,,,,
1422813817403285505,KarelHavlicek_,"Sr치쬶a vlak콢. Vlak Ex 351 projel n치v캩stidlo v poloze St콢j ve v칳hybn캩 Radonice na Doma쬷icku a srazil se s osobn칤m vlakem. Situace je v치쬹치, ru코칤m ve코ker칳 program a jsem na cest캩 na m칤sto ne코t캩st칤.",1105851826702897152,1422813817403285505,,cs,2021-08-04T06:57:03.000Z,FALSE,Twitter for Android,Karel Havl칤캜ek,FALSE,"","M칤stop콏edseda Vl치dy 캛R @strakovka, ministr @mpo_tweetuje, ministr @min_dopravy a m칤stop콏edseda @Vedavyzkum",https://pbs.twimg.com/profile_images/1267448425416667136/LJWj2A2r_normal.jpg,2019-03-13T15:23:16.000Z,FALSE,,,25,319,38,2929,129,25474,202,,,,,
